{
  "specVersion": "0.1",
  "id": "tax_2025_brightside",
  "engagementId": "eng_brightside_2025",
  "taxYear": 2025,
  "returnType": "s_corp",
  "formNumber": "1120-S",
  "currentStage": "in_review",
  "stages": [
    {
      "stage": "gathering",
      "status": "complete",
      "owner": { "id": "usr_lee", "name": "Lee Morgan", "role": "preparer" },
      "enteredAt": "2026-02-01T00:00:00Z",
      "completedAt": "2026-02-20T00:00:00Z"
    },
    {
      "stage": "in_preparation",
      "status": "complete",
      "owner": { "id": "usr_lee", "name": "Lee Morgan", "role": "preparer" },
      "enteredAt": "2026-02-20T00:00:00Z",
      "completedAt": "2026-03-04T00:00:00Z"
    },
    {
      "stage": "in_review",
      "status": "in_progress",
      "owner": { "id": "usr_pat", "name": "Pat Quinn", "role": "reviewer" },
      "enteredAt": "2026-03-04T00:00:00Z"
    }
  ],
  "reviewComments": [
    {
      "id": "rc_001",
      "body": "Confirm officer compensation is reasonable vs distributions before sign-off.",
      "severity": "must_fix",
      "status": "open",
      "author": { "id": "usr_pat", "name": "Pat Quinn" },
      "createdAt": "2026-03-05T14:20:00Z"
    }
  ]
}
